{
  "asset_id": "generic_satellite",
  "kind": "satellite",
  "uri": "/visual-assets/procedural/spacecraft/satellites/generic_satellite/model.glb",
  "size_m": 16,
  "attribution": "AeroDT contributors; original procedural placeholder geometry; CC0-1.0.",
  "temporary": true,
  "metadata_uri": "/visual-assets/procedural/spacecraft/satellites/generic_satellite/asset.json",
  "schema_version": 1,
  "units": "metres",
  "axes": {
    "forward": "+X",
    "up": "+Y",
    "handedness": "right"
  },
  "license": "CC0-1.0",
  "thumbnail_uri": "/visual-assets/procedural/spacecraft/satellites/generic_satellite/thumbnail.svg",
  "description": "Original generic visual placeholder, not a physical or branded vehicle model.",
  "size_definition": "Largest model-space bounding-box dimension; no node scale transforms."
}
