{
  "asset_id": "generic_aircraft",
  "kind": "aircraft",
  "uri": "/visual-assets/procedural/aircraft/civilian/generic_aircraft/model.glb",
  "size_m": 32,
  "attribution": "AeroDT contributors; original procedural placeholder geometry; CC0-1.0.",
  "temporary": true,
  "metadata_uri": "/visual-assets/procedural/aircraft/civilian/generic_aircraft/asset.json",
  "schema_version": 1,
  "units": "metres",
  "axes": {
    "forward": "+X",
    "up": "+Y",
    "handedness": "right"
  },
  "license": "CC0-1.0",
  "thumbnail_uri": "/visual-assets/procedural/aircraft/civilian/generic_aircraft/thumbnail.svg",
  "description": "Original generic visual placeholder, not a physical or branded vehicle model.",
  "size_definition": "Largest model-space bounding-box dimension; no node scale transforms."
}
